{
  "schema_version": 1,
  "dispatch_key": "oci:service",
  "kind": "oci",
  "class": "service",
  "restart": "never",
  "execution": {
    "oci": {
      "image": {
        "reference": "ghcr.io/example/service:v1",
        "digest": "sha256:aaaaaaaaaaaaaaaaaaaaaaaaaaaaaaaaaaaaaaaaaaaaaaaaaaaaaaaaaaaaaaaa"
      }
    }
  }
}
