{
  "schema_version": 1,
  "dispatch_key": "oci:computer",
  "kind": "oci",
  "class": "service",
  "restart": "always",
  "routing_tags": ["wefty:node:computer-a"],
  "execution": {
    "oci": {
      "image": {
        "reference": "ghcr.io/example/computer:v1",
        "digest": "sha256:aaaaaaaaaaaaaaaaaaaaaaaaaaaaaaaaaaaaaaaaaaaaaaaaaaaaaaaaaaaaaaaa"
      },
      "limits": {
        "memory_bytes": 1073741824
      },
      "computer": {
        "display": {
          "protocol": "rfb-websocket-v1"
        },
        "disk_bytes": 8589934592
      }
    }
  }
}
